Key,Value,Bytes,Stored?,Time to store,Retrieved Value,Retrieved Bytes,Time to get,Correct Key-Value?
test#1,This test should fail due to the special character in the name,62,"NOT STORED
",0.40530943870544434,END ,FOUND,0.6718900203704834,False
test 2,This test should fail due to the space in the name,50,"Unable to process command 
",0.0,An error occurred when parsing server return,process,0.001028299331665039,False
test3 ,Not sure if this should work? ,30,"Unable to process command 
",0.0,An error occurred when parsing server return,process,0.0005052089691162109,False
longtestlongtestlongtestlongtestlongtestlongtestlongtestlongtestlongtestlongtestlongtestlongtestlongtestlongtestlongtestlongtestlongtestlongtestlongtestlongtestlongtestlongtestlongtestlongtestlongtestlongtestlongtestlongtestlongtestlongtestlongtestlongtestlongtest,This test should fail due to the length of the string,53,"NOT STORED
",0.3030059337615967,END ,FOUND,0.3035614490509033,False
5voyageare,world 7 4 are credit present jelly whisper hello program 3 suit space ,70,"STORED
",0.9107332229614258,world 7 4 are credit present jelly whisper hello program 3 suit space ,70,0.6612961292266846,True
