Key,Value,Bytes,Stored?,Time to store,Retrieved Value,Retrieved Bytes,Time to get,Correct Key-Value?
test#1,This test should fail due to the special character in the name,62,"NOT STORED
",0.1191108226776123,An error occurred when parsing server return,Error has Occurred,0.3169071674346924,False
test 2,This test should fail due to the space in the name,50,"Unable to process command 
",0.0004985332489013672,An error occurred when parsing server return,process,0.0005319118499755859,False
test3 ,This test should fail due to the space in the name,50,"Unable to process command 
",0.0,An error occurred when parsing server return,process,0.0,False
longtestlongtestlongtestlongtestlongtestlongtestlongtestlongtestlongtestlongtestlongtestlongtestlongtestlongtestlongtestlongtestlongtestlongtestlongtestlongtestlongtestlongtestlongtestlongtestlongtestlongtestlongtestlongtestlongtestlongtestlongtestlongtestlongtest,This test should fail due to the length of the string,53,"STORED
",0.24394536018371582,END ,FOUND,0.08660626411437988,False
hello,jelly crowded ,14,"NOT STORED
",0.02965378761291504,willing force 8 gaming keyboard 8 program ,42,0.48012661933898926,False
jellypresent,jelly present exuberant build imprint program you let build shape ,66,"NOT STORED
",0.08257675170898438,END ,FOUND,0.048716068267822266,False
1gamingyou,world whisper 8 program application ,36,"STORED
",0.0323185920715332,world whisper 8 program application ,36,0.6805462837219238,True
evaporatecreditvoyage,world exuberant are voyage 3 gaming keyboard voyage force whisper 6 program jelly application 7 ,96,"STORED
",0.4612085819244385,jelly present exuberant build imprint program you let build shape ,66,0.0005078315734863281,False
