Key,Value,Bytes,Stored?,Time to store,Retrieved Value,Retrieved Bytes,Time to get,Correct Key-Value?
test#1,This test should fail due to the special character in the name,62,"NOT STORED
",0.9336791038513184,END ,FOUND,0.8965940475463867,False
test 2,This test should fail due to the space in the name,50,"Unable to process command 
",0.002692699432373047,An error occurred when parsing server return,process,0.0010008811950683594,False
test3 ,This test should fail due to the space in the name,50,"Unable to process command 
",0.0014967918395996094,An error occurred when parsing server return,process,0.0009996891021728516,False
longtestlongtestlongtestlongtestlongtestlongtestlongtestlongtestlongtestlongtestlongtestlongtestlongtestlongtestlongtestlongtestlongtestlongtestlongtestlongtestlongtestlongtestlongtestlongtestlongtestlongtestlongtestlongtestlongtestlongtestlongtestlongtestlongtest,This test should fail due to the length of the string,53,"NOT STORED
",0.7401299476623535,END ,FOUND,0.6939668655395508,False
jelly,present limping 4 gaming voyage are 7 javascript shape 5 ,57,"STORED
",0.7584872245788574,present limping 4 gaming voyage are 7 javascript shape 5 ,57,0.268308162689209,True
imprintapplication,world present zipper zipper program ,36,"STORED
",0.5845916271209717,world present zipper zipper program ,36,0.9085781574249268,True
