Key,Value,Bytes,Stored?,Time to store,Retrieved Value,Retrieved Bytes,Time to get,Correct Key-Value?
test#1,This test should fail due to the special character in the name,62,"NOT STORED
",0.2568387985229492,END ,FOUND,0.33402419090270996,False
test 2,This test should fail due to the space in the name,50,"Unable to process command 
",0.009301424026489258,An error occurred when parsing server return,process,0.0012154579162597656,False
test3 ,This test should fail due to the space in the name,50,"Unable to process command 
",0.002498626708984375,An error occurred when parsing server return,process,0.0007061958312988281,False
longtestlongtestlongtestlongtestlongtestlongtestlongtestlongtestlongtestlongtestlongtestlongtestlongtestlongtestlongtestlongtestlongtestlongtestlongtestlongtestlongtestlongtestlongtestlongtestlongtestlongtestlongtestlongtestlongtestlongtestlongtestlongtestlongtest,This test should fail due to the length of the string,53,"NOT STORED
",0.9211146831512451,END ,FOUND,0.3554377555847168,False
voyage1application,zipper force ,13,"STORED
",0.762474775314331,zipper force ,13,0.4744551181793213,True
